{
  "$schema": "../schema/procedure.schema.json",
  "id": "2jz-ge-vvti-timing-belt",
  "revision": 1,
  "title": "Timing belt replacement",
  "system": "timing-drive",
  "keywords": ["timing belt", "cam belt", "tensioner", "idler", "camshaft pulley", "VVT-i", "crankshaft pulley", "water pump access"],
  "configurationIds": ["lexus-gs300-jzs160-2000-us-lhd"],
  "engineVariantId": "2jz-ge-vvti-jzs160",
  "assembly": "2jz-ge-vvti-jzs160/r1",
  "contentStatus": "educational-overview",
  "statusNote": "Educational overview. The phase order and page locators come from a third-party mirror of RM718U and have not been checked against a licensed copy. No torque, force or dimension values are entered. Use the licensed factory manual for every sub-step, specification and diagram.",
  "sources": [
    { "sourceId": "rm718u", "locator": "EM-14 to EM-28 (timing belt)" },
    { "sourceId": "rm718u-mirror-em", "locator": "EM-14 to EM-28" },
    { "sourceId": "rm718u-mirror-charm", "locator": "Timing Belt — Service and Repair" }
  ],
  "tools": [
    { "id": "factory-manual", "name": "RM718U repair manual (licensed copy)", "detail": "Required for specifications, diagrams and full sub-steps.", "status": "documented" },
    { "id": "sst-crank-holding", "name": "Crankshaft pulley holding tool (SST)", "detail": "SST part numbers not entered.", "status": "mirror-derived", "sourceRef": { "sourceId": "rm718u-mirror-em", "locator": "EM-16" } },
    { "id": "sst-puller", "name": "Pulley puller (SST)", "detail": "SST part numbers not entered.", "status": "mirror-derived", "sourceRef": { "sourceId": "rm718u-mirror-em", "locator": "EM-18–20" } },
    { "id": "torque-wrench", "name": "Torque wrench", "detail": "Range depends on specifications not yet entered.", "status": "mirror-derived", "sourceRef": { "sourceId": "rm718u-mirror-em", "locator": "EM-23–28" } },
    { "id": "hex-bits", "name": "Hex bit sockets", "detail": "Sizes not entered.", "status": "mirror-derived", "sourceRef": { "sourceId": "rm718u-mirror-em", "locator": "EM-14–15" } },
    { "id": "press", "name": "Press for tensioner compression", "detail": "Force limit not entered. Compress slowly.", "status": "mirror-derived", "sourceRef": { "sourceId": "rm718u-mirror-em", "locator": "EM-26" } },
    { "id": "retaining-pin", "name": "Tensioner retaining pin", "detail": "Pin diameter not entered.", "status": "mirror-derived", "sourceRef": { "sourceId": "rm718u-mirror-em", "locator": "EM-26" } },
    { "id": "coolant-drain", "name": "Coolant drain pan and funnel", "detail": "Coolant capacity and type not entered.", "status": "mirror-derived", "sourceRef": { "sourceId": "rm718u-mirror-em", "locator": "EM-16; CO-section" } }
  ],
  "parts": [
    { "id": "timing-belt-new", "name": "Timing belt", "componentId": "timing-belt", "partNumber": null, "status": "not-established", "note": "OEM part number must come from the Lexus EPC for the production range." },
    { "id": "idler-if-required", "name": "Timing belt idler (if inspection fails)", "componentId": "timing-belt-idler", "partNumber": null, "status": "not-established", "note": "Replacement criteria are in the inspection pages." },
    { "id": "tensioner-if-required", "name": "Hydraulic tensioner (if inspection fails)", "componentId": "timing-belt-tensioner", "partNumber": null, "status": "not-established", "note": "Replacement criteria are in the inspection pages." },
    { "id": "seals-gaskets", "name": "Replacement seals and gaskets specified by the manual", "componentId": null, "partNumber": null, "status": "not-established", "note": "The installation pages specify replacement seals and adhesive. Exact items not entered." },
    { "id": "coolant", "name": "Engine coolant", "componentId": null, "partNumber": null, "status": "not-established", "note": "Type and capacity not entered." }
  ],
  "preparation": {
    "checklist": [
      { "id": "confirm-engine", "text": "Confirm that the vehicle is a 2000 US GS300 with the 2JZ-GE VVT-i. This guide does not apply to non-VVT-i 2JZ-GE or 2JZ-GTE engines." },
      { "id": "licensed-manual", "text": "Have the licensed RM718U timing-belt chapter and its linked cooling and charging pages available." },
      { "id": "cold-engine", "text": "Plan the work on a cold engine.", "sourceRef": { "sourceId": "rm718u-mirror-em", "locator": "EM-23" } },
      { "id": "tools-ready", "text": "Collect the tools listed below and look up every value the manual specifies for them." },
      { "id": "parts-ready", "text": "Source the replacement belt and any parts that inspection may require by part number from the OEM catalog." }
    ],
    "cautions": [
      { "level": "warning", "text": "Moving the crankshaft or camshafts with the belt removed can allow piston-to-valve contact. Follow the factory positioning sequence.", "status": "mirror-derived", "sourceRef": { "sourceId": "rm718u-mirror-em", "locator": "EM-17" } },
      { "level": "caution", "text": "Do not loosen the factory-set bolts on the VVT-i camshaft timing pulley.", "status": "mirror-derived", "sourceRef": { "sourceId": "rm718u-mirror-em", "locator": "EM-18–20" } }
    ]
  },
  "steps": [
    {
      "id": "under-cover-coolant",
      "title": "Under-cover and coolant",
      "phase": "access",
      "instructions": [
        "Remove the engine under-cover.",
        "Drain the engine coolant as described in the linked cooling-system page."
      ],
      "prerequisites": [],
      "componentIds": ["engine-under-cover", "radiator-assembly"],
      "tools": ["coolant-drain"],
      "replacementParts": [],
      "specifications": [
        { "id": "coolant-capacity", "label": "Coolant capacity", "value": null, "unit": "L", "status": "not-entered", "sourceRef": { "sourceId": "rm718u", "locator": "CO section" } }
      ],
      "view": { "camera": "lower-front", "remove": ["engine-under-cover"], "restore": [], "hide": [], "highlight": ["engine-under-cover", "radiator-assembly"] },
      "cautions": [{ "level": "caution", "text": "Hot coolant is under pressure. Work on a cold engine." }],
      "completionChecks": [
        { "id": "cover-off", "text": "Under-cover removed and fasteners stored." },
        { "id": "coolant-drained", "text": "Coolant drained into a container." }
      ],
      "sourceRefs": [{ "sourceId": "rm718u-mirror-em", "locator": "EM-16, steps 1–9" }],
      "contentStatus": "mirror-derived",
      "gaps": ["Drain plug location and coolant capacity not entered."]
    },
    {
      "id": "radiator",
      "title": "Radiator assembly",
      "phase": "access",
      "instructions": [
        "Remove the radiator assembly following the linked cooling-system procedure (CO-18).",
        "Disconnect the radiator hoses and the connections listed there before lifting the radiator out."
      ],
      "prerequisites": ["under-cover-coolant"],
      "componentIds": ["radiator-assembly", "radiator-hose-upper", "radiator-hose-lower"],
      "tools": [],
      "replacementParts": [],
      "specifications": [],
      "view": { "camera": "front-left", "remove": ["radiator-assembly", "radiator-hose-upper", "radiator-hose-lower"], "restore": [], "hide": [], "highlight": ["radiator-assembly", "radiator-hose-upper", "radiator-hose-lower"] },
      "cautions": [],
      "completionChecks": [{ "id": "radiator-out", "text": "Radiator assembly removed and openings protected from debris." }],
      "sourceRefs": [{ "sourceId": "rm718u-mirror-em", "locator": "EM-16; linked CO-18" }],
      "contentStatus": "mirror-derived",
      "gaps": ["The radiator assembly is shown as one grouped model. Fans, shroud and cooler lines are not separated.", "Hose routing is illustrative."]
    },
    {
      "id": "accessory-belt",
      "title": "Accessory drive belt",
      "phase": "access",
      "instructions": [
        "Release the accessory belt tensioner and remove the accessory drive belt (linked CH-1).",
        "The accessory belt is separate from the timing belt. It drives external accessories and does not set valve timing."
      ],
      "prerequisites": ["radiator"],
      "componentIds": ["accessory-drive-belt", "accessory-belt-tensioner"],
      "tools": [],
      "replacementParts": [],
      "specifications": [],
      "view": { "camera": "front", "remove": ["accessory-drive-belt"], "restore": [], "hide": [], "highlight": ["accessory-drive-belt", "accessory-belt-tensioner"] },
      "cautions": [],
      "completionChecks": [{ "id": "belt-off", "text": "Accessory belt removed. Routing noted for reinstallation." }],
      "sourceRefs": [{ "sourceId": "rm718u-mirror-em", "locator": "EM-16; linked CH-1" }],
      "contentStatus": "mirror-derived",
      "gaps": ["Accessory belt routing in the model is illustrative and must not be used as a routing diagram."]
    },
    {
      "id": "power-steering-pump",
      "title": "Power-steering pump and front bracket",
      "phase": "access",
      "instructions": [
        "Detach the power-steering pump and its front bracket as the factory access sequence describes.",
        "Check in the manual whether the pump stays connected to its lines and is set aside. The model only moves it out of view."
      ],
      "prerequisites": ["accessory-belt"],
      "componentIds": ["power-steering-pump", "power-steering-pump-bracket"],
      "tools": [],
      "replacementParts": [],
      "specifications": [],
      "view": { "camera": "front-left", "remove": ["power-steering-pump", "power-steering-pump-bracket"], "restore": [], "hide": [], "highlight": ["power-steering-pump", "power-steering-pump-bracket"] },
      "cautions": [],
      "completionChecks": [{ "id": "ps-clear", "text": "Pump and bracket clear of the upper timing cover. Hoses supported and not kinked." }],
      "sourceRefs": [{ "sourceId": "rm718u-mirror-em", "locator": "EM-16" }],
      "contentStatus": "mirror-derived",
      "gaps": ["Whether lines are disconnected is not established.", "Pump and bracket positions are estimated."]
    },